"---3OXpexMp0oAg77xWfYA";"5";"2012-04-07 00:00:00";"Pizza here made my night... Good people and great pizza. They can do anything you ask with a great attitude!";"2";"0";"0";"Slice of Vegas";"Las Vegas";"NV";"Vegan"
"--0RrdW5mtHa-Oeyzy4RjQ";"5";"2016-07-29 00:00:00";"Wow! This place is awesome. Everyone is so nice and helpful. The clean Checkup juice is amazing as is the daily dose shot. Great for anti-inflammatory and immune system. The #2 available bowl is also amazing! We were going to share one and decided it was too good and got our own.";"0";"0";"0";"Raw Organic Juice Bar";"Chandler";"AZ";"Vegan"
"--1Uj2FGirXqBmi_oA6-qg";"5";"2014-07-13 00:00:00";"Outstanding food and service. 

The atmosphere of the restaurant is very pleasant, and the servers were friendly right away. They all were highly knowledgable about the menu items and were eager to tell us how things were made, what their favourites are, etc. They all had great personalities and seemed to enjoy their jobs. 

The food and drinks were all amazingly delicious. I had the coconut curry soup, my girlfriend had the eggplant tempeh. We each got a drink off the summer drinks menu and had temaki cones to start. The food was flavourful and well-presented.

The server even thanked me for the generous tip I left, something most servers don't do. I'm a server myself so I know that lots of places don't acknowledge tips, good or bad, and that's just how it is. It was nice to hear a genuine thank you. She even told us she hoped our flight home in the morning was safe. 

You won't be disappointed at this place!";"3";"0";"0";"Vegetarian Haven";"Toronto";"ON";"Vegan"
"--c6GUtseZhMHA0rSfnN8w";"5";"2015-09-30 00:00:00";"This was our second, but certainly not our last, visit to Nandini's. We ordered lamb biryani and lamb korma. Both were perfectly spiced and seasoned. The lamb was fork tender. Don't forget to order the naan - garlic and regular. Large portions and loved the leftovers. Oh! Did we mention the mango lassi?";"1";"0";"1";"Nandini Indian Cuisine";"Tempe";"AZ";"Vegan"
"--DiZOzXn1uAPpdom4Hqhw";"5";"2013-06-13 00:00:00";"Absolutely perfect. Free wifi great coffee and great atmosphere.";"0";"0";"0";"Smelly Cat Coffee";"Charlotte";"NC";"Vegan"
"--iWdjX4JMdOnsxn-0K0JA";"5";"2016-01-19 00:00:00";"Fresh, delicious and healthy food.  Service was even better. I especially liked the ability to choose vegan options and special orders. I will be back.";"0";"0";"0";"Red Velvet Cafe";"Las Vegas";"NV";"Vegan"
"--jV6gScLsqZYE1oyS_2MA";"4";"2016-02-06 00:00:00";"Loved the interior decor of the restaurant. Full of plants and flowers. The vegan dishes were excellent! We came in for breakfast and we ordered tofu breakfast tacos and the french toast. Very natural taste and of course satisfying. Will come back during another vegas weekend. 

One note that i would recommend to the staff is to always have someone in the front of the restaurant ti greet incoming guests. I witnessed two parties walked out because they were unattended.";"0";"0";"0";"VegeNation";"Las Vegas";"NV";"Vegan"
"--k01htSwpX-RKVBy85l3w";"4";"2016-12-28 00:00:00";"YES. The food was incredible. We had the vegan tasting menu and it was truly delicious. I loved all of the appetizers and the mains, but the eggplant appetizer and the greens in the main were especially amazing. The injera was fluffy and sour, the way it should be. I also tried one of the micro-brewed beers on the menu and it was great. The only reason this is a 4 instead of a 5 star review is that, given the ingredients used (lentils, split peas, veggies), it is quite pricey. $30 per person before tax/tip/drinks is a lot when every other Ethiopian restaurant I've been to (and I've tried many!) has charged around $10-$15 while serving a similar amount of food. It's true that the quality at Nil Bleu is top notch, as was the service and ambiance, but it's hard to want to pay double what you would elsewhere for very similar food.

Edit: Forgot to mention that none of the dishes were spicy, which for some people might be important for Ethiopian food. I still thought they were all delicious, but the person I was with was disappointed.";"1";"0";"1";"Nil Bleu";"Montréal";"QC";"Vegan"
"--kqF5xA8BrKMoKkZy4pWQ";"1";"2016-03-11 00:00:00";"I asked for a simple... Simple orange juice.... What did the you my lady bring?.... Two bottles of organic orange juice from any supermarket.
So I asked.... Is that what you are going to give me or are you gonna give me fresh squeezed orange juice?
She replied: "" no, this is all so have""
I decided not to argue and asked for the menu. 
I see her attitude and I keep reading the list of juices and smoothies.
I chose the orange, carrot and ginger. And to my surprise , guess what.... Yes, she gets the fresh orange form the fridge. Almost $19 for two juices. And the worst service . Overrated and no idea what vegetarians want or need.";"4";"3";"1";"Violette's Vegan Organic Cafe & Juice Bar";"Las Vegas";"NV";"Vegan"
"--kV0u-JueIewYop-nBF9A";"4";"2010-07-08 00:00:00";"The vegan buffalo chicken wrap is still the bomb, the red velvet cake is still delectable! 

I think they've hired more people, because the service lately (I've been twice in the last month) has been really good and fast! I got my takeout order in about 10 min, and was tended to in a timely manner when I dined in with two others.

They are also trying out a bunch of new desserts each month; I had the tiramisu (very good) and strawberry creme (meh).";"3";"0";"2";"Red Velvet Cafe";"Las Vegas";"NV";"Vegan"
"--kwEVaBDLIbWFViVHGleA";"5";"2017-02-21 00:00:00";"Copper Branch satisfied both me and my foodie-vegan friends (clarification: I am not vegan, or even vegetarian, but I can get down with tofu when the duty calls), so if you're looking for a quick spot to satisfy multiple dietary preferences, I give this place my full endorsement. We were literally standing on a street corner, starving and cranky after a long and foodless trek up and back down Mont Royal and Rue Peel, when Copper Branch appeared on Yelp and saved the day. 

I had the ""Aristotle"" bowl, which was a massive bowl filled with fresh greens, sweet potato, avocado, smoked tofu, a balsamic-based dressing, and other yummy veggies. It was extremely filling! I shared a raspberry chia pudding with my friend, which was delish, if a little runny. My friends loved their bowls and sandwiches, including a very pink beet burger. There are tons of vegan and gluten-free dessert options, and many of the entrees are gluten-free as well.

Oh-- the POUTINE! Vegan poutine sounded like an oxymoron to me, but damn, this was GOOD. The fries are thin-cut and delectable and topped by vegan gravy and cheese sauce that is really, really, really yummy. Get it!";"9";"0";"2";"Copper Branch";"Montréal";"QC";"Vegan"
"--opRWsqWdoGYF6UXZyFmQ";"3";"2012-11-14 00:00:00";"Dotty's has a reputation for good burgers. They have some pretty good burgers, but it never really blew my mind. Dotty's was just a little too packed when I went and it was hard to get a conversation going or even hear myself think. I would recommend trying to get to Dotty's at an odd dinner hour or earlier in the evening.";"0";"0";"0";"Dotty Dumpling's Dowry";"Madison";"WI";"Vegan"
"--pUmhzGbQTiqK3k-4XY2A";"4";"2013-02-25 00:00:00";"Great food, great laid back atmosphere. I gave it a four because the service was slow and there was quite a bit of a wait, but I really loved this place. I highly recommend the falafel!";"0";"0";"0";"Tommy's Restaurant";"Cleveland Heights";"OH";"Vegan"
"--stv8AY9Z7T15rU0JOhAw";"5";"2017-10-19 00:00:00";"Great staff, food and atmosphere. Loved the open seating shared table. 

PS... the brisket is amazing!";"1";"0";"1";"Carson Kitchen";"Las Vegas";"NV";"Vegan"
"--uS8m5plfWe9Yn4VZI9Cw";"5";"2011-04-26 00:00:00";"Awesome food and great ambience.
Reasonable prices.
its byob so make sure u take ur own bottle of wine to go with the great food.";"0";"0";"0";"Abay Ethiopian Cuisine";"Pittsburgh";"PA";"Vegan"
"--XGYpSXCF3C6uu9hE5XzQ";"2";"2017-06-04 00:00:00";"First time here. A bit disappointed. Ambiance is okay. Great music. Not the best service. There's no inside or air conditioning and it was 107 today. The misters worked wonders though. It was nice to sit right on Mill Ave. 


Seeing no one else with food should have been a red flag for me. I ordered food nonetheless. I ordered Carne Assad tacos and a Moscow mule. Initially I had no intention to drink but I waited so damn long to receive a menu and have my order I felt like it didn't make sense not to. From when I got there to when I ordered I kid you not it took nearly 45 minutes. I contemplated leaving a few times but I stayed because the reviews are so decent I just had to try. 

I had to ask for just meat and cilantro. They normally pre-mix everything in the tacos. I asked for corn tortilla, was served flour. I was too hungry to send it back. The damn carne asada was soooooo oily and salty. Unnecessarily salty actually. Bland rice. Bland beans. It wasn't until after I received my food that I realized that his place is known for its alcohol buckets. Not the food. 

Eat here at your own risk. Might be a cool place to come hang out when it isn't too hot and want a place to go have just drinks with friends.";"1";"1";"0";"CASA Sunbá";"Tempe";"AZ";"Vegan"
"--yFTmTc79z1yakzAXhd3A";"4";"2017-01-30 00:00:00";"So I decided to try this place based on the four to five star reviews & I was excited that I was able to stumble upon a place that caters to vegetarians & Vegans which is a plus. Now about what I ordered...

Tonight I ordered the orange chicken & burger to go. When I try a new place, I always order two dishes just in case one is not so great. The total meal cost a little over $14.00

The orange chicken was pretty bland and unfortunately soggy; which was sad because I only had a 9 minute drive back to my destination. Plus there was not much of the orange sauce on the chicken or in the container which would have been nice to mix with the white rice .

The burger was pretty tasty, it comes with fries. I didn't feel a need to add any additional toppings to it when I arrived home. I would definitely order this again.

The final verdict: the orange chicken was a bust, but the burger saved the night!! Four stars overall.

There are other options that look good, so I will give this place another chance to see if I'll stick with my current rating. Maybe next time I'll dine in to see if my experience is different..";"1";"0";"0";"Veggie Village";"Phoenix";"AZ";"Vegan"
"--zwNbEGFPUGwAZteHri5w";"4";"2017-10-23 00:00:00";"100% Vegan?! Is this real life?! Yes, yes it is. 

This place is amazing. The cinnamon rolls are amazing. The prices are amazing. The baby buns are the cutest thing ever and perfect for both my kids. They are so generous with the toppings and everything we tried tasted incredible! 

We live in Henderson so the 25-30 minute drive REALLY sucks so, hopefully we can get one over here soon but please believe that drive won't keep me away. So worth it. 

The prices of the drinks are a little ridiculous ($3.25 for one small water) which is a trap because you definitely need a drink after your sweet tooth takes a hit. 

But other than that they are doing everything right!";"1";"0";"0";"Cinnaholic";"Las Vegas";"NV";"Vegan"
"-054EThRYSErHoaFinNGhA";"1";"2016-11-19 00:00:00";"Just when I thought things couldn't get worse...

We decided that since our first visit occurred shortly after Planta opened, we would give it another shot. There would be no way the service could have been as poor as our first encounter. So, we went for lunch.

We were seated promptly and immediately asked the waitress to help us choose a NON fried, NON salad item from the appetizer selections that we could share since we had each ordered a salad as a main.  She suggested the butternut squash and mushrooms.  Great!  Ten minutes later an arugula salad topped with squash and mushrooms arrived.  Although salty, it was tasty but we we did ask our waitress why she suggested a salad to start when our mains were each a salad.  She just stood there and smiled. (NOTE: The menu mentions nothing about the squash and mushrooms being served upon a bed of arugula.  Hmmm...)

Thirty five minutes later as we watched table after table receive their hot entrees (might I add they were patrons who arrived AFTER we did) we began to wonder why our salads had not arrived.  Once again, we asked our waitress what was going on.  She looked dumbfounded and walked away as we watched her approach a young man at the front of the restaurant.  They exchanged some words, he turned around to look at us and then he walked directly to the back of the restaurant toward the kitchen.  As we sat there hungry and frustrated, we decided at that moment that this was a most disorganized and thoughtless establishment and it was time to leave. Five minutes later, as we were getting our coats on, the young man arrived at our table with two salads in his hands.  When we asked about the wait, he said there really wasn't an excuse excuse - it was simply a ""mix-up"".  At that point we told him how this very same situation we encountered only a month prior and we would not tolerate it AGAIN.  We offered to pay for what we had eaten but he apologized for the situation and told us just to leave.

Planta, it is so hard to believe you are a part of the Chase group.  In fact, you call yourself the CHASE HOSPITALITY GROUP.  There was nothing hospitable about our visits. The breakdown in communication is terribly apparent.  After my first review, someone from your restaurant reached out to me privately for my email address so they could chat with me further.  I immediately provided it.  Did anyone ever get back to me?  Nope!

As a long time vegetarian, I had high hopes for your (supposedly) upscale restaurant that would cater to my eating habits.  You have disappointed me and my family and we will never return.";"2";"0";"0";"Planta";"Toronto";"ON";"Vegan"
"-07JTvYVcJ0OWZB52YvnAg";"1";"2011-09-18 00:00:00";"Service is not good. The food tastes flat. The ambiance is somewhere between a sports bar, a mongolian BBQ and a cheap chinese restaurant. The drinks are not good and prepared by non-professional barmen and barwomen. I had to ask for the bowls to be replaced because they were dirty and the waitress didn't see anything wrong!!! For the same money I can have better food across the street at Pei-Wei.";"0";"0";"0";"Genghis Grill";"Tempe";"AZ";"Vegan"
"-0BkIWtPXYcPN7AK1uRMSw";"4";"2016-06-24 00:00:00";"Promoting themselves as healthy dinner options we had some pretty tasty food.  The vegetable dip appetizer with ranch and an olive did were good.  The sea bass I had was excellent as was my wife's pasta.  

One area to improve. How about some ice in the water.  Luke warm served water was just horrible.  Is there a health advantage to serving warm water (maybe there is).  

Service was good with them being crowded.";"0";"0";"0";"True Food Kitchen";"Scottsdale";"AZ";"Vegan"
"-0fJ9e_3Jt-BE21gqWM4AQ";"5";"2015-06-26 00:00:00";"Absolutely delicious. Fresh ingredients that don't hide under heavy sauces. Great alternative to the regular taco shops.";"0";"0";"0";"La Santisima";"Phoenix";"AZ";"Vegan"
"-0gnp3NVPou9Chlycork9Q";"4";"2016-11-06 00:00:00";"I went for Sunday breakfast. Well it was 12:10p, but it was Sunday so who's counting? Do note that on Sunday brunch service ends at 1p. When I got to Tommy's there was a wait of about 20 minutes with 5 groups ahead of me. Interestingly enough you add your own name to the host waitlist (a clipboard lying on the counter to the left). A whole bunch of regulars seemed to know this. 

Once seated things moved quickly and the coffee, which was really quite good, was continually refilled. 

I ordered the Elsie Combo. It is basically a triple decker BLT plus two fried eggs, American cheese and house made peanut butter ($6.29). I got mine on rye. It was, despite the peanut butter, a pretty simple tasting sandwich. I did enjoy it though and would get it again. 

My friend got the Zeke which is like an omelet wrapped in pita bread. In this particular dish there were also onions, green peppers and American cheese.

Both entrees were a little small and are a la carte so you may want to consider a side of sausage or something. 

Despite a full house I didn't feel rushed. We were given more coffee even when handed our check so there was no rush to leave. Next time I want to go for lunch. The milkshake and burger seemed popular.";"0";"0";"0";"Tommy's Restaurant";"Cleveland Heights";"OH";"Vegan"
"-0HU04qk8KX-9NeV73cV2A";"5";"2015-03-02 00:00:00";"Visited them at the Gilbert Farmers market Saturday.
(What a great place with vegan/vegetarian things to buy!)

Had the Tempeh breakfast sandwich which was tasty and filling.
(Would have liked a little bit more sauce and a whole tomato slice.)

Ya I am picky sometimes...

Loved the Un-Pop Tart!";"1";"1";"0";"The Uprooted Kitchen";"Gilbert";"AZ";"Vegan"
"-0jwdCVEnnJByT99_BPP2g";"4";"2011-05-24 00:00:00";"I love Blue Nile! I have read the reviews saying it's not as flavorful as Cafe Lalibella down the road; however, I find them both to be extremely delightful and delicious. I love the veggie/vegan/raw options that are available. As a person with many veggie friends, this is always an easy and healthy choice to pick. They also have tea and amazing coffee. 

The only thing that is usually not impressive about Blue Nile is the service. Although there are a couple of nice people on the waitstaff, it's overall not up to par. If you go at a slow time, though, no worries.";"0";"0";"0";"Blue Nile Cafe";"Tempe";"AZ";"Vegan"
"-0KJD06i4LgA8k0kp8tKlw";"4";"2017-09-22 00:00:00";"Okay so first off, dumb me. I was craving a dirty martini and clearly you don't order one from a Thai place. I tried any way because there was a martini featured on the drink menu and it included olives. Considering the anticipated and welcomed language barrier from a terrific Thai restaurant, my dirty martini came to the table as the feature martini from the menu which included a lot of basil and olives-not a good mix. That being said the place is small but wasn't too packed for a 9pm dinner on a Saturday night. The service was fast, and the food was absolutely delicious. The beef mint salad is one of my go to Thai menu items and I must say it was by far the best mint beef Thai salad I have ever had. I cannot wait to go back, but definitely not for the martini feature.";"0";"0";"0";"Nicky's Thai Kitchen";"Pittsburgh";"PA";"Vegan"
"-0L5gLpCE0nCbXLYXnGIfA";"1";"2016-02-17 00:00:00";"This place sucks!!! It's so expensive for so-so quality of food... We ordered ""spicy"" but there was not a single chili in our dish. Every dish was salty and didn't taste very good (not good enough for the price for sure). 

But we are most upset about the horrible customer service. We complained to them that the price was wrong (that they charged us too much) but they said it was actually too little (can you believe it?) and they made the price even higher!!!!! They said it was their mistake they had forgotten to charge us for the rice. 

When we ordered the entrees, the waitress asked us which kind of rice we wanted, brown or white, so we assumed all dishes came with rice. They didn't inform us that we had to pay extra for rice. It was so confusing. 

We are vegan and always go to many locations of Loving Hut in many cities around the world and I have to say that this has been the worst experience dining at Loving Hut ever! Not a chance we will go back there. 

It was their mistake to start with and they still dared to change the price to even higher after we had complained about being charged wrong. It was such an incredibly rude service. Who would do this to a customer? These guys should learn the art of customer service from Starbucks. If I could give it zero star, I would.

If you have a car, go to Loving Hut in Tempe (near ASU). It's just a bit down the south. I love all the staff members there including the owner. They are all ""extremely"" nice. We were very very impressed with their service. They changed the orders according to our requests (replaced soy protein with tofu, cooked without onions etc.) and really made the food spicy. They also let us use their private bathroom etc. Customer service is a huge factor to a great dining experience. If you care to have a good experience, choose the Tempe location. Just so much better!!!";"1";"1";"0";"Loving Hut";"Phoenix";"AZ";"Vegan"
"-0lr8RXbZWLh5Hdcy_Uhzw";"4";"2010-01-05 00:00:00";"Wisconsin cheese belongs on Wisconsin burgers. A staple for the kids of UW Madison, this tavern-style restaurant offers a lot in the way of burger selection. I enjoyed the Runnelstone immensely and the garlic sauce, though very heavy in mayo, was darn tasty. I also enjoyed the basket of fried deliciousness that came as an appetizer. Fried Cheese Curds are better than any cheese in California.";"1";"1";"0";"Dotty Dumpling's Dowry";"Madison";"WI";"Vegan"
"-0oM7CyPwBWYPqyqJLsI-A";"2";"2009-07-22 00:00:00";"I just noticed that this place had opened and did pulled a u-turn to go try it out in the hopes I might get another first review. Once I got in I was a little confused because I didn't realize it wasn't a sit down and order type place. Instead you go up to the counter place your order, take a seat, and your order comes out to you. So I start looking over the menu I see the familiar mediterranean fair, but I notice a difference. They make their hummus and baba ganoush with yogurt. Instant turn off.

Despite this I decide to give the place a chance and I order a vegetable skewer and plato's potatoes. Turn's out plato's potatoes is just french fries with another name. I think ate two or three and gave up. The vegetable skewer was pretty decent and actually had a hunk of peach in it, which was a nice twist. Unfortunately that was not enough to make up for everything else.";"2";"0";"0";"Market Grille Cafe";"Las Vegas";"NV";"Vegan"
"-0pluR0EURoZ1z6UEElV1g";"5";"2008-04-30 00:00:00";"Since I moved from Tempe to San Diego, I have been mourning for my favorite place on earth. Excellent veggie selection, great quality of ingredients, friendly service and perfect location.

You Tempe crowd out there, you might be suffering from the heat and you might be dying to move to San Diego. Let me tell you, DON""T if you are an Ethiopian food fan like me. You will be very disappointed as you will not find anything close to Blue Nile here. While there, enjoy it!";"0";"0";"0";"Blue Nile Cafe";"Tempe";"AZ";"Vegan"
"-0reqFK0aY6Cip6tVRKI_w";"5";"2016-07-30 00:00:00";"Once again I love this place, the food is amazing and the staff super courteous.  Weekend girl friends trip to vegas,  and the only thing safe to report back is the amazing breakfast we shared here before heading home - kidding 

None of us could decide what to eat so we decided to order it all and share. 

* First thing was the check in sangira's super yummy and needed! 
* Chick'n and waffles,  really!!! thank you to the gods the oldand the new.  This was amazing.  the waffle was crispy and not to sweet and paired with the friend chick'n and a little syrup and hot sauce we were in love.
* Bao-wow This steamed bun was amazing  
*East West Tacos - a little diffacult to eat, but I just went for it, these had a great texture and flavor.  
* My little dumpling - shitake mushroom and spinache dumpling - only complaint was there was not enough,  these were delish.";"1";"0";"0";"VegeNation";"Las Vegas";"NV";"Vegan"
"-0ScxYiTibKxVHW7Ei1cCg";"5";"2016-06-08 00:00:00";"I will definitely have to come back when there's happy hour. Sat at the bar a few weeks ago .. The bartenders Were super nice and helpful . Had beer, elotes, tacos and some unlimited chips and salsa . Pretty filling. Their taco selection were very tasty. I love the atmosphere . Very crowded , which is a good thing!";"0";"0";"1";"Hussong's Cantina Boca Park";"Las Vegas";"NV";"Vegan"
"-0TMYDTYzqzWNSMZgYBJlg";"5";"2017-03-15 00:00:00";"Makes my life so much easier!! I go in before my 9 year old son and I train, get our dinners and then I don't have to stress about what I am going to feed him after we work out! And I know it's healthy and better yet, it's tasty!! I have had a lot of vegan plant based foods out there. They don't stack up to PPP! Other places take out the animal products and it seems the flavor too! Not here!! Will knows what he is doing! PPP has been such a lifesaver for this busy single mom!! Don't believe me then check it out yourself!";"3";"0";"0";"Plant Powered Prep";"Chandler";"AZ";"Vegan"
"-0y4061iB9pcw-sn7u7MHw";"5";"2017-10-25 00:00:00";"Best hot dog place in all of Phoenix! Owners are from Colombia so they know how to make real, authentic Colombian-style hot dogs. They have great lunch specials and I love the variety they bring to the place.

They also have Colombian sodas and other appetizers that give me a quick reminder of how good food from home is. If you like hot dogs, like to support a family-owned local business, do yourself a favor and stop by here. You won't regret it!";"1";"0";"0";"Simon's Hot Dogs";"Scottsdale";"AZ";"Vegan"
"-107To4WUkrqmnR7zbWj5g";"5";"2015-03-28 00:00:00";"It is difficult to find a restaurant that a vegan and her carnivore husband can eat at together. Grasslands gets a five star rating from both of us!!! 
We shared the apple fitters. DELICIOUS 
We each had the green eggs no ham. Equally delicious. The Bloody Mary was incredible. 
The only drawback was that they had run out of Daiya cheese but hopefully that's not a regular occurrence. Will definitely be going back.";"1";"0";"0";"Grasslands";"Toronto";"ON";"Vegan"
