"-aToZygduWG2DWdwn5VlBQ";"5";"2015-09-01 00:00:00";"I love this place! My boyfriend and I go to ASU and we often go for their ""happy hour"" deal. Their happy hour is if you order a sandwich to eat in you get free chips and a drink! It's a really good deal and it's great food. Recently my boyfriend and I went in and the staff was friendly and there was a guy who I didn't recognize as an employee he was offering us free samples of pizza they made to see if they wanted to put it on the menu, we politely declined and he and my boyfriend talked a little while I ordered. When my boyfriend and I went to pay the cashier told my boyfriend that ""Ike had paid for our meal. He came and told me and I was confused but then I noticed the cartoons of Ike on the walls and it made sense. The employee offering samples was Ike! After we received our food we thanked him for our free food and had a small conversation. I haven't had such great customer service in a long time and it just makes me loves this place even more!";"1";"0";"1";"Ike's Love & Sandwiches";"Tempe";"AZ";"Vegan"
"-AWW0P7ijDn8izA68WCdXg";"5";"2017-07-28 00:00:00";"I'm a bit new at Indian food but being a vegetarian I thought I would try this place out. I'm hooked, the food is great. Wonderful flavors, large menu and great prices. I had the Aloo Tiki Chaat which is my favorite . The Vadapaav was very good also. There is so much more I want to try there.  The only negative would be the person behind the counter wasn't the friendliest but she wasn't rude either.";"0";"0";"0";"Lotus Deli";"Mesa";"AZ";"Vegan"
"-ax7SVQ6E6v9i8ezW18_WQ";"5";"2016-03-23 00:00:00";"Love grabba green. Just not their prices. 20 bucks for a small grain bowl (all priced at 10) and a smoothie at 7.";"0";"0";"0";"Grabbagreen Downtown - Phoenix";"Phoenix";"AZ";"Vegan"
"-AXqb12qv-aCHV6-qkDgMw";"5";"2017-05-21 00:00:00";"Living in Morningside, it is worth battling the current construction traffic and multiple bridge detours, to get to ""the other side of town"" for some Onion Maiden.

Yes, it's Cash only. Yes, it's all vegan. But don't let that be a dealbreaker - because you'll be missing out on some of the most amazing comfort food. Our favorite is the ""McMaiden sandwich"" on Saturday morning brunch, however. It is PERFECT, and there is no sacrifice in taste or quantity of food - the ""egg"", the ""cheese"", the ""bacon"". Absolutely crave-satiating. The roasted potatoes give all other breakfast diners a run for their money. These potatoes don't even need condiments (and I'm a total Pittsburgh basic b*tch that puts Heinz on everything potato). I could also eat the Kale 'Em All salad every single day with every single meal. 

Sometimes I want to be gluttonous and order two meals at a time for myself - but then I wouldn't have room for the donuts. And WHICH ONE TO CHOOSE FROM!!! #firstworldproblems There are usually some classic favorites to choose from (like the chocolate-mousse filled ""Cronos""), and then some surprise flavors that have cereal, or pretzels, or ""Blood Stains"" on top. No matter what flavor we have tried, they all just seem to melt in your mouth. 

The music, menu items, and atmosphere is also great for those who love Rock music, of all kinds. There's even a poster from Club Laga, for all of us old Pitt kids. Even if you're not a fan of Rock, the decor isn't obnoxious, and the music ranges from classic to metal to punk to ska. No one is left out. 

If you're not willing to go to the other side of town for an amazing donut, then try them out at Artisan Café on Penn Ave. All of the deliciousness; none of the traffic.";"3";"0";"0";"Onion Maiden";"Pittsburgh";"PA";"Vegan"
"-AYYnjHJTbGTiB0NXLAa6Q";"3";"2017-07-24 00:00:00";"I like this place, and I really like the bamboo bowl with protein and extra veggies. Always a good choice when it's prepared right. What I don't like is every time I come close to 8pm (closing time) they are out of or don't want to make the ingredients for my bamboo bowl. I get it, it's 7:45, you've broken down your area, ready to go home, but don't screw me over cause you are lazy. I know you didn't run out of chicken or the special sauce, you just don't want to peel back the food wrap, and stay an extra 60 seconds. Now, 7:30 on Monday July 24th 2017, I roll up after a 12hr hard labor day, stoked about my bamboo bowl, and nope, closed. Cool you want to close at 7, change your hours from 8am - 8pm to whatever pleases you. Just as it pleases me to write this review and never drive out of my way to support your business again. Food is on point. Service blows.";"2";"1";"0";"Freshii";"Charlotte";"NC";"Vegan"
"-AzfHZ2uUhJSk9GAVGlXuQ";"4";"2014-10-17 00:00:00";"This was my first vegan restaurant and let me say that i was suprised how delicious it was.

I ordered the ""pulled pork"" banh mi sandwich with kale salad and it was savoury and tasty! 

The restaurant wasnt very busy on a Friday afternoon but service was still great.

Would definitely come back again to try their quinoa mac n'cheese.";"2";"0";"0";"Grasshopper Restaurant";"Toronto";"ON";"Vegan"
"-B15GNChOdY-ZpXeiQ5DEg";"5";"2017-08-12 00:00:00";"Best. Ever. It was my first time eating at the Bronze Cafe and it was soooo good. I got the bizness salad with brussel sprouts, chickpeas and quinoa along with the soup of the day and brookie using a Groupon that I got a while ago. The salad alone is enough to leave you full and satisfied because of the generous portion you're given. It would be smart to eat half of everything and split it into two meals. Only thing is it would've been nice if the brookie had a nut mixed in. I like my brownies with nuts, but it was still delicious.";"0";"0";"0";"Bronze Cafe at The Center";"Las Vegas";"NV";"Vegan"
"-b1mYRBqIEyC_zbX4eLWvQ";"3";"2017-02-09 00:00:00";"Visited tonight for a casual birthday dinner, can't complain. Came to this location once before, over a year ago, and was prepared to never come back; a birthday request for nachos changed that. 

We came in and were promptly greeted by the friendly hostess, she got us seated pretty quickly and let us know Morgan would be our server. She took our drink orders, when she came back I checked in for the free Margarita which I ordered on the rocks. She brought out my Margarita, was a little heavy on the salt but over all tasty and definitely had more alcohol than expected in a discount drink. 

When we ordered, Morgan let us know portions are pretty big and even gave some tips on how to reheat at home. We got the street corn app, supreme nachos, and lobster/crab nachos. Overall everything was tasty and the topping to chip ratio was pretty good, although I felt I paid more for the mango salsa on my nachos vs the crab and lobster sprinkle. The entire meal cost about $50, felt over priced for the mango salsa nachos and everything else. Upbeat atmosphere and friendly staff, still unsure that's enough to bring me back for the food and it's prices.";"0";"0";"0";"Nacho Daddy";"Las Vegas";"NV";"Vegan"
"-B1Qi7158HeMQV6yeLFHKQ";"5";"2017-07-22 00:00:00";"My family and I ate at Nacho Daddy last night. The nachos satisfied my nacho craving. Our server, Tiffany, was friendly and efficient. The service at this location is superb! The manager was also kind. Thank you guys!";"0";"0";"0";"Nacho Daddy";"Las Vegas";"NV";"Vegan"
"-b3ZalcWicdmSeG1a_gWrg";"4";"2016-05-22 00:00:00";"This is the first time at this location. Wife and I had the unlimited chips and salsa. We also shared the filet mignon nachos and had a couple of iced teas. Total was not bad $30. And a full stomach. 

I will come again!";"1";"0";"0";"Nacho Daddy";"Las Vegas";"NV";"Vegan"
"-b4Llss-pqRMI9Gj5lxQaw";"5";"2015-09-20 00:00:00";"$@$king awesome!

Getting ready for an ultra distance triathlon and this was just what the doctor ordered! Whoa";"0";"0";"0";"VegeNation";"Las Vegas";"NV";"Vegan"
"-B5lpF58e48-DldwPMw7eg";"5";"2013-09-27 00:00:00";"My first visit wasn't the greatest because of the service (but then again, they had just opened at 7AM on a Saturday, and I'm sure I wouldn't be very bright eyed and bushy tailed that early either), but I came back again because the food was EXCELLENT. On my second visit, I had an extremely friendly woman take my order and my sour attitude about their customer service went right out the window.

I dream about the sweet potato hash. And the blue bird sandwhich. Seriously. These are two menu items you MUST try!

This cafe is not something you would expect inside of a tiny strip mall across from the lake. The food is unique and the atmosphere is cozy. It can easily be missed if you're passing through, so look out for it next time you're in the neighborhood!";"1";"0";"1";"Crema Cafe";"Madison";"WI";"Vegan"
"-b6tupD1xFrjTrWr9unJxQ";"5";"2015-07-31 00:00:00";"I really do love the whole concept of these fro-yo places.  It's fun to pick your flavors and toppings.  As an added bonus - the yogurt at Picadilly is made with better ingredients.  I don't go here because it's organic, but since it is, it makes me feel better about eating a giant bowl of dessert!  The yogurt is really good, the store is well kept, and the staff is friendly.  I'll keep going back.";"4";"1";"2";"Piccadilly Artisan Yogurt and Creamery";"Mount Lebanon";"PA";"Vegan"
"-b75eg-m8yHop3IxI9amGw";"5";"2016-01-11 00:00:00";"Food quality is 4/5; service was super friendly and accommodating so that deserves an extra star.

This is a vegetarian chinese restaurant. I am not a vegetarian but like to come here once in a while for a change. 

This restaurant has been around for many many years. I used to be a regular customer there when we lived in the area. We moved so we don't get to eat here as frequently as I would like. The quality of food remains good after so many years.

The restaurant looks dodgy, but food is good and portions are large; great value.
Dinner for a group of 6 people cost us $50 with apps and entrees.

Appetizers:
- immitation duck: my all time favorite, delish
- spring rolls: my least favorite , too much cabbage. I would prefer soya rolls
- taro rolls: if you like taro (a type of yam), you will like this. Very rich and filling.
- soya rolls: yummy with bamboo shoots and chinese mushroom. I would recommend it 

Entrees, we tried:
- Buddha mixed vegetables fried noodles: chow mein was crispy. One of my fav
- general tao chicken: I'm not a big fan, too doughy but my friends loved it
- mock beef with tofu BBQ sauce: delish, highly recommend it. The tofu was so flavourful 
- stir fried green beans with soy: good flavour, I liked the beans 

Overall, good reliable vegetarian chinese food with large portions at very reasonable price. If you're looking for a fancy sit down place, this is not the place for you. The manager (or owner?) was super nice and friendly";"2";"0";"1";"Buddha's Vegetarian Foods";"Toronto";"ON";"Vegan"
"-b7VqGkry-iYrT6hnTj80A";"5";"2017-05-24 00:00:00";"I had the pleasure of dining at Pancho's Kitchen this evening. Jocelyn, our waitress, provided great service and the tacos are tasty.";"0";"0";"0";"Pancho's Kitchen";"Las Vegas";"NV";"Vegan"
"-BbFA2_8gUC1zJulS4PYLg";"4";"2014-03-04 00:00:00";"Luna's Living Kitchen serves very good vegetarian and vegan food.  It is a great place to go for a healthy meal.  I had one of their special meals, Gaia's Treasure, which I enjoyed. My wife had the vegetarian taco salad, which I liked better.  Another person in our party had the veggie burger and she said it was excellent.  Even the desserts are good, and healthy.  The ginger ale is homemade and very strong.  The chai latte was good too, but on ice it is weaker than I would like.  Overall, we had a very good meal with good service.  The food is not cheap even though it isn't cooked!";"0";"0";"0";"Luna's Living Kitchen";"Charlotte";"NC";"Vegan"
"-bcHSvMXedqWnU7XWcxhow";"5";"2017-01-23 00:00:00";"This place is new, clean, and fresh! You have to try the hula acai bowl and the paradise juice with vegan protein!";"0";"0";"0";"Bowlology";"Las Vegas";"NV";"Vegan"
"-BDICTzSXpob-6JmZ-e05Q";"5";"2015-04-19 00:00:00";"Pretty awesome. Superb vegan food, causal atmosphere - but still nice enough for a date or a business meal. The plating of the food was quite amazing and great attentive service - thank you Vanessa! I had the vegan sushi which was spectacular, the east west tacos which were good but a little difficult to eat without getting messy, and I had the chocolate and strawberry tacos for desert which were just about perfect. The best vegan food I've ever had and just a great place for great food in general.";"0";"0";"0";"VegeNation";"Las Vegas";"NV";"Vegan"
"-bj4BeMZKn36MjW_bFO_UA";"1";"2016-05-05 00:00:00";"NECHE is the most BORING place to go no one is there the costumer service sucks and the food is nasty (Vegas DONT GO) BLUE martini kicks there ass in all ways . This is a TERrIBle place to go  bad food worst costumer service ever";"1";"1";"1";"Nēche Restaurant & Ultra Lounge";"Las Vegas";"NV";"Vegan"
"-bj7Rr4bC5lwL6HzyA0caw";"3";"2017-06-10 00:00:00";"I had eggs this morning: 2, over medium with a touch of chili powder. I like eggs a lot. They're full of protein and fats, and when your on a low carb diet, those are you're end all be all of comfort. 

The reason I preface my review of lunch with what I had for breakfast is I want you to appreciate how hungry I was. When you cut bread and sugar from your diet, staying satiated for longer than the run time of a long movie is pretty much out the window. The plus side is you can eat more without gaining weight on account of your body not being able to rely on that sweet sweet sugar for energy. 

The negative? When you do wait, like I did, for a traditional meal to eat (to be fair, I fell asleep watching lectures on YouTube. Don't judge my Saturday) you get super hungies. So I'm yelping, and  I find this well reviewed kebab place about a 15 minute drive down 74, or in charlotte terms, down the street. I could really go for some lamb at this point, so I throw on some clothes and hit the door. 

I pull into Sycamore Commons, a shopping area I frequent, so imagine my surprise when the Google box directs me to this secluded little alcove behind the Best Buy, replete with shops and a massage envy,  and a sweet frog. Amongst them is the kebab place. 

The hostess seats me outside facing the fountain. The set up of the main dining room is slick, because no matter where they seat you, you walk by a deli style display case featuring ready to cook skewers of beef, of chicken, of salmon to whet your appetite. The outdoor seating area has nice stylish large umbrellas to keep the sun at bay. 

The menu is classic Mediterranean, all lamb and mint and tsaziki. I ordered minced lamb - which comes in a kebab and is served with basmati rice, a tabouleh salad and hot tea. If you recall the opening paragraph, you'll remember the low carb thing, and wonder why I didn't sub out the rice for, like, a chicken wing or something. Well i, in fact, did sub it out for the Spicy Lebanese salad.

Then the spiral downward started. My order came out, and boy howdy was it wrong. The first transgression: no tabouleh. I love tabouleh. It'd been over a year since I had it, and my excitement to have it again was severely dampened by the distinct lack of it on my plate. I did get rice, though. Rice I didn't want because of the low carb thing. I tasted it. It was good. Exceptional even. Especially the carrot slaw they had on top. But still, low carb is in effect,  so I couldn't actually enjoy the rice. 

Second transgression: the Spicy Lebanese salad, which came out as a side was fine. But it was out as a side and not the rice substitute that I wanted it to be. I ate it. It was pretty good, not quiet what I wanted it to be, but solid enough. 

Third transgression: as I approach the bottom of my salad i have decided not to complain (because God clearly wanted me to have that rice and not tabouleh, otherwise he wouldn't have put the rice and not the tabouleh in front of me). I look again at the fountain. It's very nice, calming. Relaxing.  Three spires in white plaster or stucco, can't really tell from where I am, with water cascading down the bronze or tiled (again, can't tell) centers. It's a good fountain. I bite down on my salad, and to my horror, there's a crunch that matches no other crunch in the salad to that point. And the crunch has a bitterness, and a dryness. I spat that bite out to reveal splinters of charred black something. I was now upset. 

No tabouleh? Forgivable. Rice when I can't eat it? Cruel, but I can look past that. But burned splinters in the salad? A bridge too far. 

Now you're probably thinking that this is a 1 star, no recommendation review. You'd be only half right. I'm not going to recommend kebab-je because they made a Slack first impression. However they should thank the server, because no sooner than I brought the various transgressions to his attention, did he not only comp my burnt splinter salad, but he did also bring me to-go tabouleh, which is second only to during the meal tabouleh on the tabouleh depth chart.

Plus the kebab was tasty (could've used a dipping sauce, but I liked it). And until it was burnt, the salad was good. And the rice was delicious. And my water cup wasn't empty until I left.

I probably won't be back for a while, though.

*P.S., the owner has apologized and invited me back. Adding a half star to My review for the consideration. Also the tabouleh was among the best tabouleh I've had. Easily one of the 3 best salads in Charlotte. Adding another half star for the tabouleh alone.";"2";"2";"1";"Kabab-Je Rotisserie & Grille";"Matthews";"NC";"Vegan"
"-bjwJwRawN3ODu8enK1XiA";"1";"2017-05-28 00:00:00";"I don't even care how good the food is, because i have waited 30 mins for a pork curry, this place at most is getting a 3 star from me...

I mean seriously?  30 mins for a chicken curry, i cannot believe with this amount of reviews and traffic, with this kind of speed...  

I was excited to try this place because my wife said it has the best curry, but i will never waste 30 mins waiting for a curry... unbelievable

Okay, i just got my order and the curry i ordered and it does not look like curry at all... chefs curry looks like the picture i uploaded.  

Service was horrible, i asked the waitress i have been waiting for 40 mins can you check whats going on, she started showing terrible attitude, while it was 100% the restaurants fault for letting customer wait 40+ minutes while it wasn't even that busy.

Never come back and be warned to waste 30+ time.";"2";"1";"0";"Komol Restaurant";"Las Vegas";"NV";"Vegan"
"-BK7KMVJoWRwlvhxF1xlbg";"4";"2012-07-18 00:00:00";"Forget that Bean is vegan. It's just delicious food served in a comfortable place. 

My only experience with Jackfruit previously was an ex-girlfriend that was eating dried chips of it she fell in love with on a trip to Thailand. Our helpful waitress explained that Jackfruit has two different textures depending on how ripe it is. That is Jackfruit is meaty and perfect for shredding when unripe and is slightly sweet when fully ripe. When I say helpful waitress I really mean it. This visit was with a friend of mine with gluten & other food allergies. The waitress helpfully answered questions of what would be safe for my friend and what the cooks could do to change up what items. We ended up both ordering the Jackfruit Tacos, with slight modifications to my friends order.

When our food arrived and I had my first bite I was an instant convert. The jackfruit tacos were amazing just a wonderful spicing and such texture. The only clue I wasn't having carnitas was just a little hint of missing umami. Even then so many flavors were in this dish it is the number one thing you should order. I capped my my meal off with a peanut butter cupcake with chocolate icing that was also delicious.

Lest this review be one sided I went back for dinner a week later. This time I ordered the buffalo tofu finger with side orders of zucchini & kale. The sauce that came with it was almost a tzatziki but it paired well with the buffalo sauce that was spicey but not overly so and most importantly not oily. The only downside to this experience is their sweet tea isn't very sweet. However, they have have sugar in the raw & sweet n' low if you prefer your beverage equine fatal.";"8";"1";"5";"Bean Vegan Cuisine";"Charlotte";"NC";"Vegan"
"-BlbuBgY4LmSGIjP_1QM6A";"5";"2016-07-10 00:00:00";"The Cafe was recommended as a place my husband, who has medical problems, could eat. What a find! When we explained what could and could not be consumed, suggestions for lunch were graciously offered with explanantions about the ingredients, making our selections easy. My husband had the My Sweet Pepper (as a salad), I had the Greek Vegan Burger with the zucchini salad on the side and our son had the Not-Cho-Macho Pizza, all quite delicious. Great food, gracious, friendly and accommodating staff/owner and so inviting. The place was very busy (always a good sign).  We even brought home their Oatmeal Mix. The three of us really enjoyed eating here. The Oatmeal Cafe could well become our favorite place and we look forward to going back as often as we can.";"0";"0";"0";"Iss' Magic Mixes";"Mesa";"AZ";"Vegan"
"-BRGgDCuUe4JQ5zlD8uBWQ";"5";"2015-06-03 00:00:00";"Such a beautiful restaurant and friendly staff.  I felt welcomed and the owner herself came over and greeted my husband and I. That was really nice. The food was good and dessert was even better! Chocolate cake was satisfying! I am making this my number one go to vegan restaurant because I had quality service and good food. service matters so much to me as well cleanliness and they are good on both! Especially after having such a terrible experience with both of those things at vegenation. I know where I am treated fairly and that's what I'm sticking to from now on.";"0";"0";"1";"Violette's Vegan Organic Cafe & Juice Bar";"Las Vegas";"NV";"Vegan"
"-bRNA30CmjGJvAzbj_XnRg";"2";"2016-10-31 00:00:00";"So I heard that pizzaiolo has vegan pizza, they do, but it was quite disappointing.

It was a late night and i was hungry for a slice. The only vegan option that was available had zucchini and spinach for toppings. Now if you are going to serve vegan pizza then at least put some effort and use mock cheese, or maybe consider more palatable toppings. Regardless, the crust was not up to par.

But it's not like I had better options. I guess vegans can't be choosers.";"3";"3";"3";"Pizzaiolo";"Toronto";"ON";"Vegan"
"-bRrUyJfc-rWNTX50vCpUw";"5";"2015-04-14 00:00:00";"Love this fun...and fantastic coffee shop. Haven't had a bad experience yet. I LOVE the Alien Burrito with some sarachi. ..AWESOME!";"0";"0";"0";"Sunrise Coffee";"Las Vegas";"NV";"Vegan"
"-bs84qUXaIp3oDLunIsb7w";"4";"2016-04-05 00:00:00";"First time and the atmosphere was pretty dope..from the art work to the literature for lgbt community.Staff was friendly and very knowledgeable about their menu. We bought pressed juice ,coffee, and desserts to go along with it. Will definitely be back with the kids.";"0";"0";"0";"Bronze Cafe at The Center";"Las Vegas";"NV";"Vegan"
"-bsKvgH4Zc_t8ZQXYDUSAw";"5";"2013-02-01 00:00:00";"I'm a carnivore, but this place is so delicious. It might be one of the only places to get real, non-greasy food around campus. It always makes me feel satisfied for several hours, whereas other places you feel hungry about an hour later.
Om nom nom! Try a cup of chili with brown rice + veggies.

Furthermore on fridays they have a really sweet band playing, today there was a guitar, banjo, and a double-bass. Awesome.";"1";"0";"0";"The Red Herring Vegetarian Restaurant";"Urbana";"IL";"Vegan"
"-BUPvzx-2Sl4bZIL9NRnzw";"4";"2016-06-03 00:00:00";"I don't know why some gave this place bad reviews. I think the food is creative (and gets more creative every time I go) and very tasty. For reviewers who said the food was flavorless, I wonder what sort of restaurants they go to. Either that or my taste-buds are broken (or theirs are, so they need 5 times more spices than everyone else).

I think it's nice that the menu includes some fake meats. I gave up meat for different reasons, but I do like having fake meats once in a while, especially if I'm craving it. So even if those dishes aren't the most creative, it's a great thing to have for people who miss meat (or non-vegas/non-vegetarians).

I've had their lavender cake, fibbish and chips, various salads, soups, spaghetti/meatballs, and their ""random creations"" specials only for valentine's day. I liked everything I had.

I have NOT tried anything with vegan cheese yet. All vegan cheeses I've tried elsewhere taste like sour feet, so I'm hesitant on getting one of the dishes containing vegan cheese - mostly because it'll be a waste of the dish if I can finish it and because it's a little expensive. I'll try it one of these days though.";"0";"0";"0";"The Dancing Dog Eatery & Juicery";"Urbana";"IL";"Vegan"
"-BVznafV0zZu-cdhiKBNlg";"4";"2016-08-23 00:00:00";"S'pretty good. Inexpensive food. Great calzones. The seating area is adequate. They have my favorite brand of tea there. They run all sorts of specials constantly. 

Great for the college student or person looking for hot food on the go.";"0";"0";"0";"DP Dough";"Tempe";"AZ";"Vegan"
"-BwI1bykWYnvSlHseu8EKQ";"5";"2014-05-01 00:00:00";"Eddies has been my favorite place to get some cheap, delicious, late night pizza. The pizza might not be the best slice youve ever had, but it is definitely a worthy pie. Everytime I have gone I have not been disapointed. The people behind the counter can be a bit unatentive at times, but for the most part they are friendly and cool. Love Eddies, keep it up!";"0";"0";"0";"Eddie's Pizza And Lounge";"Tempe";"AZ";"Vegan"
