"-F1aIhTUAab60X2luRJwWw";"4";"2015-08-07 00:00:00";"The food was AMAZING. The white trash burger was so fantastic and just the right amount of food for just the right price. Our particular server had a bad attitude, hence only the 4 stars, but another girl picked up our table and was ridiculously sweet and an all in all fantastic server. The servers' clothes are a little skimpy and it is partly a bar, so I wouldn't take small children here.";"0";"0";"0";"Pinky's Westside Grill";"Huntersville";"NC";"Vegan"
"-F1hRG6upcsXkrmmjRJrZg";"3";"2011-03-27 00:00:00";"Not bad.

Don't go for lunch because it's a different experience. They cut out too many things.
I've been there a lot by virtue of working in the area and having one of my good friends stay in the area.


If you want to have a good time, this is the formula: 

Go on a monday or tuesday when you can bring your own wine for free.
If in a group, order a shit load of appetizers and try everything (for every one person, order 1.25 appetizers). Then share a bunch of entrees, at a ratio of about 2/3rd the number of people.
This way, you will each spend about $30 but you will be stuffed and have tried so many different things. 
This has been the winning formula in my experience. 
  
Service is good, fun, cool water service, nice at night!

oh and for dessert, you have to order the Knaffa ana. Normally this dish is made with warm cheese, but i ventured out and tried their version with 
cream and rose syrup and it blew my mind.

p.s LCBO is jut down the street south on yonge!";"6";"2";"2";"Tabule Restaurant";"Toronto";"ON";"Vegan"
"-f60JDueb0NxnCYzecLvxg";"5";"2015-08-24 00:00:00";"The food was wonderful, and the staff were all really friendly.  I wish I was in Vegas more often so I'd have more time to go back and try more of their menu, as there were a ton of good looking options on there.  The atmosphere was also nice, as I was there alone and sat at the large community table where I had some nice conversation with the other solo guests.

There was a big storm the particular night that I was there that knocked out the restaurant's POS system so it took them a while to get me a check.  To make up for the long wait they offered me a dessert on the house, which was a really nice gesture.  I wasn't upset by the wait though because I was enjoying the food and conversation (both with waiters and patrons) so much.  Overall really great place for vegetarians and vegans, and I can't wait to visit them again next time I'm in town.";"1";"0";"0";"VegeNation";"Las Vegas";"NV";"Vegan"
"-f7dBSJNTd0_v4CMEQ0TyQ";"4";"2015-01-04 00:00:00";"I am a longtime lover of Aladdins but I can't stand the parking situation at the local restaurants. I recently stumbled upon Dolce Wraps and woah! I had the falafel salad and the lentil soup. The salad was very good and the lentil soup was the best I have ever tasted! I loved the cozy ambiance and the service was excellent. The woman who assisted us was very helpful and overly kind. She recommended tweeks to the menu items and I was beyond satisfied. She was beyond courteous. My only complaint is that they had no fresh silverware for eating in. We had to use plastic utensils which sounds trite but I really dislike plastic utensils. When I asked another employee about utensils she told me they were all out of silverware and she seemed somewhat annoyed that I even asked for them.  Ps. I have celiac disease and the woman who served us was very knowledgable about gluten and reassured me that the items I chose were gluten free.";"2";"0";"1";"Dolce Wraps";"Fairview Park";"OH";"Vegan"
"-F8yXmpFnukIq5zkCY9uBg";"5";"2017-02-11 00:00:00";"Just had another yummy all vegan selection at Vegenation, the East West Taco (actually it's three tacos with all fresh ingredients), and an Evocation beer that they get from the Craft Haus Brewery in Henderson. My wife had her go to favorite, the Vegenation Burger that comes with these huge fries they make there. We love Vegenation (and my wife isn't even vegan), the food, staff, music they play (although I'm more of a fan of the reggae that's usually playing when I'm there, tonight it was more on the punk side - nothing wrong with that), and overall ambience! I love seeing that Vegenation is doing well, I always see such an interesting diversity of people that also seem to love this restaurant!";"2";"0";"1";"VegeNation";"Las Vegas";"NV";"Vegan"
"-fBS-lHi9Q5kRNQjCE0Lxg";"4";"2011-10-21 00:00:00";"I love the food here, especially the Mexicali Combination. I'm not a health food nut, although I am coming around to avoiding all the damn chemicals and preservatives that the food and pharm industries like us to consume.

It is not cheap to eat organic or raw, so the food here is not inexpensive. But every once in a while my body says, ""Dude,"" (I call my friends Dude often so I think my body is trying to mimick me here) ""Dude,"" it says, ""I need something in that raw, yummy goodness so please direct the car to the Raw Food Cafe."" I find that when I oblige, I feel much better, especially the next day or two. If I don't, it's okay, as long as I don't mind paying the price for resisting my body's request for the fuel it is asking for.";"2";"0";"1";"Go Raw Cafe";"Las Vegas";"NV";"Vegan"
"-FEdUZFtkYEV1-9Gevhg-Q";"4";"2013-01-31 00:00:00";"Holy incredible brownies batwoman. Whether you are or are not gluten free these are Hulkify with happy, call upon the superheros good. My mouth is working just thinking about it. So dark chocolately and moist. Goodness gracious. And the gluten free chocolate chip cookies are buttery and home made tasting and freaking delish as well. Plus the ladies are hilarious, I recommend going to visit on a quiet Saturday and prepare to be cracked up. 

This is a small pretty storefront with a big kitchen behind where the team is pumping out gluten free goodness for lots of other celiac minded joints in town. You can get gluten free breads, prepared meals, biscotti, crackers, etc. Well worth a visit.";"11";"6";"5";"Mi & Stu";"Lasalle";"QC";"Vegan"
"-Fg-jyInktEgzApijKW9ZQ";"4";"2012-10-17 00:00:00";"Vegan fuckin' donuts dude.

Every other donut bakes up wishing it could be these donuts. 

This will be the best thing you put in your mouth in the mornings before work or the mornings after partying on the strip (or you know, both at the same time). Best thing - I don't care how good your lover is, BEST THING YOU'LL PUT IN YOUR MOUTH THAT MORNING.

They're fresh. They're served with a smile. They're super inexpensive. They're delicious. They're VEGAN. 

Nomnomnomnom is the only actual necessary words. I had to write this review hours after eating there, because literally I spend the last several hours going ""nomnomnomnom"" until my brain remembered it had other thoughts.

You know when you fall in love and all you have is stupid romantical thoughts about your new love interest while you're supposed to be doing things like working or grocery shopping or being an adult in general? Yep, that's how I feel after Ronald's Donuts. I was thinking of writing them poetry. Maybe I will.

NOMNOMNOMNOMNOM.";"0";"3";"1";"Ronald's Donuts";"Las Vegas";"NV";"Vegan"
"-fgTGdPWq9XoUF_shwer9w";"5";"2017-01-06 00:00:00";"This is exactly the pho i've been searching Charlotte for!  I just moved back from Greensboro, where i was introduced to pho at the best, most authentic restaurant, Pho Hien Vuong.  I've been craving authentic pho for months and i haven't been able to find it anywhere!  all the other restaurants in CLT do a completely different style of pho with lots of fresh veggies, and not the right kind of broth. iPho does it right!!!  their broth is perfect, the chicken (i get Pho Ga) is succulent, and their summer rolls are delicious.  we will definitely be returning and will hopefully become regulars here!";"0";"0";"0";"iPho";"Charlotte";"NC";"Vegan"
"-fGYk3XbZGpdjQmekxbcXA";"2";"2011-01-16 00:00:00";"Are you a health nut with boat loads of cash? 

If so, this place is for you, otherwise, not so much. I can't argue with the notion of healthy, unprocessed, organic food, but this place takes it too far. Consider the beverage choices, ranging in price between $3-5. Offerings include the Red Moon (pink grapefruit, yuzu, agave and soda) and Andy's Elixir (olivella juice, agave nectar and soda water). I Googled olivella juice when I got home and it's made from sea buckthorn berries? In fairness, when I asked the waitress about the bizarre beverage offerings, she told me that Pepsi products were available, but not on the menu. 

The food menu encompasses a range of odd ingredients such as kale, tempeh, Anasazi beans, and tofu lettuce cups. To be ""safe"" I ordered the Teriyaki Brown Rice Bowl. The entree was 90% vegetables, containing minimal chicken and even less rice. It was so dry; I kept digging for even a pocket of teriyaki sauce. Even so, the dish was artfully presented. 

The man behind the True Food's brand is Dr. Andy Weil. While I admire him as a physician and originator of integrative medicine, I think he should stay out of the restaurant business.";"2";"5";"1";"True Food Kitchen";"Scottsdale";"AZ";"Vegan"
"-fhlISVcm6HaylFHasejag";"1";"2016-09-09 00:00:00";"We called in a order for lunch to be pick up and it was not ready in fact it was not made they did not ask for a name so they did not make it 
One person was running around helping four tables while the manager was talking about football at the bar while the server was running around   Will never come here again  and will make sure my client don't have to deal with this service. Then they did not have the correct order good thing I checked before leaving.";"1";"0";"0";"Little Szechuan";"Tempe";"AZ";"Vegan"
"-fIWxy_XinX04fImaliS4Q";"4";"2011-09-05 00:00:00";"Had the  pan seared halibut.  The portion is a bit small but the food is great.  Also had the acai mojitos drink.  The drink wasn't so good.";"2";"1";"1";"True Food Kitchen";"Phoenix";"AZ";"Vegan"
"-fK0cu8S38BHIzlv_OpZjQ";"1";"2016-04-06 00:00:00";"I am so bummed about this place. I was really excited to order food from here. I ordered a greens and it was to have chicken, kale, bean sprouts, and the almond sauce. I got my order back and it was missing the chicken! I didn't know it until I return back to the office. I am so bummed that this was my first experience.";"1";"0";"0";"Grabbagreen Downtown - Phoenix";"Phoenix";"AZ";"Vegan"
"-FLTgnE7nGy-DYsDv-BiMg";"5";"2013-04-03 00:00:00";"Every once in a while, I get a craving..... for DONUTS!

When I was little, every Friday my Dad would take my friend and I to a local donut shop in the bay area.  And because of those experiences, I have a place in my heart for donuts.  

When I went to Ronald's for the first time, I fell in love.  The donuts are fluffy and golden!  I'm the type of person who likes my donuts to be simple - plain or maple please (no fillings)!  Ronald's masters the art of donut creation.  I couldn't ask for anything more.  

I've introduced several of my friends to Ronald's over the years, and they've all remained loyal customers.  A box of donuts is extremely inexpensive, so be sure to spread the love and take a box or two to your work after stopping for yourself!  The presentation of the donuts (compared to other donut shops) is above average.  Almost like a piece of artwork in itself.  

For my birthday, my boss went out to buy some of their cinnamon roles to carry into the office that day... I hadn't ever tried the cinnamon roles, but they were just as good as the donuts, and everyone in the office approved!  

Don't let the ""vegan friendly"" label scare you.  They taste exactly like normal donuts, so don't let it psych you out!

If you're ever looking to satisfy a donut craving, choose Ronald's - you won't be sad you did.  *mouth drooling";"2";"1";"1";"Ronald's Donuts";"Las Vegas";"NV";"Vegan"
"-fl_5bnECSMd4AXFvdGCzQ";"1";"2014-11-19 00:00:00";"We were excited to try Glas in light of the excellent reviews and the restaurant's sponsorship of Veggielicious.  However, our experience was very disappointing for several reasons: (1) the service was very slow; (2) the restaurant was very cold (and this after we and other diners asked for the heat to be turned up); (3) the food, though good, was not remarkable; (4) the portions were shockingly small (the dessert with our tasting menu was literally a 3 inch slice of pear).  In light of the price (we spent $125 with one wine pairing), the meal was poor value.  We're sad to say that we won't be back.";"0";"1";"0";"Glas Wine Bar";"Toronto";"ON";"Vegan"
"-FOTc5qLg0YmyIDafKSELA";"3";"2016-09-16 00:00:00";"Their food is normally very good and I really like this place a lot. Their food is all vegetarian and a lot of it is vegan or can be made vegan. Their kung pao soy chicken is amazing and my husband and I have gotten it more than once. I went there tonight and got their chow mein. It was pretty gross. It was a bowl of water with some sauce mixed in and noodles and veggies. It would have been really good if the bowl wasn't filled with water. I asked the waiter if he could drain some of the water out and he asked if I meant the sauce. Definitely wouldn't recommend that dish.";"0";"0";"0";"Fresh Mint";"Scottsdale";"AZ";"Vegan"
"-foZCNu93vuuk3Rk0ZCA_A";"1";"2016-10-30 00:00:00";"I ordered from here as the room service provider for downtown grand.  The photos and Yelp reviews seemed very good.  I ordered the pastrami hash and eggs.  The eggs were cooked to order and runny but the hash had almost no pastrami.  Maybe 4 or 5 small pieces.  Then the cubed potatoes which make up 99% of the dish were very undercooked.  Very disappointed in my order, but I was so hungry I ate it anyway.";"1";"0";"0";"Freedom Beat";"Las Vegas";"NV";"Vegan"
"-fp51L-gKNmPNsc4-GmORg";"2";"2010-12-23 00:00:00";"Like other reviewers said, the shop looks nice, chairs are comfy, staff are nice.  But but but, when there was a vase falling on my head from behind, after smelly vase water splashed on me... purse, coat, skirt, papers I was reading, there was nobody offered to give me a towel or napkin, nor asking me if I got wet, although the chair I was sitting was all about flooded....  When I asked their address for my friend come to pick me up, they then gave me a card for a free drink, but alas, I am not coming back.";"0";"1";"1";"Sunrise Coffee";"Las Vegas";"NV";"Vegan"
"-FQhvz-GoaKPIhD7s12OPA";"5";"2014-06-29 00:00:00";"Food was amazing and deliscious. The salads were fresh and tasty and the black bean hummus was perfectly seasoned (not too garlicky but full of flavor). The butternut squash lasagna was perfect and flavorfull and so yummy. The carrot ginger risotto was cooked perfectly and the carrots, onions, and ginger added wonderful flavor. Nothing was oversalted. The food came quickly, was super fresh, hot, and portions were perfect. The server was very friendly. The outdoor patio was lovley and the decor was charming. Also the cookies were yummy!";"1";"0";"0";"Tin Front Cafe";"Homestead";"PA";"Vegan"
"-FrFjrFZHuea1N5JuSqOug";"5";"2017-10-27 00:00:00";"I'm not bias or exaggerating when I say this food is soooooooooo savory and filling ! My non vegan friends came with me and they had no complaints & they are picky ! 

Can't remember what burger I got but it was the first option on the burger section add mushrooms ! 

Very unimpressed with the Mac & cheese but that's honestly expected because I have not had any good vegan Mac yet !";"0";"0";"0";"Bean Vegan Cuisine";"Charlotte";"NC";"Vegan"
"-FrMx7C3Hzq4haIhQQT5Dg";"4";"2016-09-27 00:00:00";"When you crave a Po-Boy, this is the place to go. I was downtown the other day and have been wanting to try this place. I was by myself so there was no debating about where to have lunch. I ordered the Shrimp Po-Boy with onion rings. The shrimp were nicely fried, loaded onto a roll with lettuce, tomato and remoulade. As for the side... I thought I would only eat a few to find out I wish I had more, thin, crispy and loaded with flavor. 
There were many other items on the menu that I am looking forward to on my next visit.";"1";"1";"1";"Zydeco Po-Boys";"Las Vegas";"NV";"Vegan"
"-FrrrXK5D8XJCBv_9d17Gw";"5";"2017-04-04 00:00:00";"This place was quite the surprise. I was so impressed   I can't wait to go back. I had the Yellow Curry and was amazed. It was wonderful, just the perfect amount of heat and sweet. Would not have known it was all vegetarian had I not been in a vegetarian restaurant. The dish was super amazing. Let's not forget the homemade ice cream, accompanied with fried bananas finished with a strawberry sauce.";"2";"0";"3";"Vegan House";"Phoenix";"AZ";"Vegan"
"-fS0XvGgeKMms4dRyM111Q";"4";"2016-12-27 00:00:00";"This random Japanese place serves some excellent pastas.  It's quite unexpected for a place like this. We ordered bruschetta for appetizer, squid ink pasta and linguine with scallop, shrimp, and salted roe in a white creamy sauce.  All dishes were delicious.  The server was also very nice, will go back to try other dishes.";"0";"0";"0";"Trattoria Nakamura-Ya";"Las Vegas";"NV";"Vegan"
"-FS6yYNDTcqe2cKo6Qffzg";"5";"2016-12-03 00:00:00";"""Jeo"" Jovanny and Brian gave great service! Drove past this place and the name caught my eye. Came back the following day after walking through the Miracle Mile. Jovanny helped me choose my nachos. So many great options! I chose the Filet Mignon nachos which were delicious! The food and ambience here is great! Large screen tv and lots of other tvs playing good music videos. Nachos and drinks were perfect. The staff here are so welcoming as well! Manager Brian was very personable and our waiter Jovanny had us laughing and eating good! Will definitely return. It's just outside the Miracle Mile. Maybe I will be brave next time and get a scorpion shot! 
Tip- try not to over fill up on salsa and chips before your nachos! But try the salsa for sure! There were 3 bowls, mild, medium, and hot!";"0";"0";"0";"Nacho Daddy";"Las Vegas";"NV";"Vegan"
"-fspgpVyBdGd-ykGd8G3bg";"5";"2017-06-27 00:00:00";"I live in San Francisco and we are spoiled with vegan cuisine there so I was excited to try Montréal's 1st vegan restaurant! I brought an omnivore friend who lives here for Sunday brunch and we shared the Tempeh Satay, Hercules Salad w/Tofu & Huevos Rancheros. We each tried two juices. Then we had our own desserts (I'm gluten-free):  carrot cake for him and chocolate banana pie for me. The meal was wonderful. It was Frank's 1st time having tempeh so I was happy to find out your artisan tempeh was made locally.  I loved the tzatziki that came with the salad (I'm Greek!). So creamy!  The desserts were amazing!  So happy I tried you all out.  Highly recommended for casual dining.";"0";"0";"0";"Aux Vivres";"Montréal";"QC";"Vegan"
"-fTHsvPBCE2EYngMLIvBgQ";"4";"2014-07-17 00:00:00";"Food is always fresh and tasty. Definitely more money than a typical salad or sandwich, but what do you expect from these trendy spots? The food is local and there's som obscure ingredients, plus you get to feel good about eating it. It's a nice spot to go for lunch with friends or if you're on a health food kick. Would recommend the bountiful bowl, whales pasta, and grilled cheese.";"0";"0";"0";"Pomegranate Cafe";"Phoenix";"AZ";"Vegan"
"-FuJcCuy_aea8b7DFEt2Vw";"2";"2015-07-09 00:00:00";"The food here is without a doubt amazing, if it's you're first time trying out this place I would suggest the quinoa onion rings or their poutines. I've had some of their burgers but I felt that they were a little too dry and wouldn't order it again. 

Nonetheless, I hate the customer service here, all the times I've been to this location I find that the waitresses put ZERO effort into giving us any proper service. I also once wanted to order soup but god forbid I asked a different waitress other than mine and she corrected the way I named the soup and said I'm not your server i'll get yours and then stormed off. Like helllooo, I am so sorry I wanted soup. Please forgive me.";"4";"3";"0";"Fresh on Spadina";"Toronto";"ON";"Vegan"
"-FVuX2a066sJBTbmfvaP4g";"1";"2016-08-04 00:00:00";"If I could give a negative star I would...... After posting this review I was immediately called out by the owner for trying hurt his business.  After two more even stronger emails from the owner I was informed I will not be welcome there in the future!

We have eaten here in the past and the food is outstanding!  Unfortunatley this trip we weren't able to get in.  We called in the mid-day and said we had 5.... they said they cant reserve with less than 6, but if you arrive before 6:30 you should  be fine.  We arrive a bit early with an important client and the hostess was very rude and said no way you will get in here until 9 pm.  We were like we were told there would be no problem she said nope!  I then spoke to the manager who was a bit more understanding but still said no chance.  We left walked around the corner and had an amazing Mexican dinner (we were seated immediately)  and my customer was pleased!";"4";"2";"2";"Carson Kitchen";"Las Vegas";"NV";"Vegan"
"-FVYN2Df9pOUoVly27pKeQ";"1";"2013-05-24 00:00:00";"Bland, Overpriced. Plus bad service.  
We stumbled upon this cool-looking place, hungry and tired after a bike ride.
Nice décor and signage, great playlist, but surprisingly lacklustre food. 
One of us had the assiette mumbai - under-spiced, overcooked, and disappointing at 14 bucks.
I ordered  the soup de jour, which arrived only after I asked about 5 times. 
It too was devoid of any flavour, really.
If you want really good, tasty vegetarian food in Montreal, 
just go to any of the numerous falafel joints you run into. 
This place is seriously, inexplicably overrated.";"1";"0";"0";"Aux Vivres";"Montréal";"QC";"Vegan"
"-fX5ULwDexwFXLdCVS1P0A";"3";"2016-04-09 00:00:00";"The acai bowl is tasty, but really overpriced. They're lucky I ordered from postmates, if I had seen the small cup they were charging $8 for I would have gone and gotten twice as much for the same price somewhere else.";"0";"0";"0";"Greens and Proteins";"Las Vegas";"NV";"Vegan"
"-fxRB_il8h9ITLBguYCOaw";"5";"2017-04-20 00:00:00";"Food on point. We came across this place on google maps. The mac burger is awesome. Fish taco on point. Staff is great. This is def a good spot for comfort vegetarian food.";"0";"0";"0";"Green New American Vegetarian";"Tempe";"AZ";"Vegan"
"-fYxKzrzvWnikjerSKREAQ";"3";"2011-10-12 00:00:00";"Pork jerky...check...
Reasonable price...check...
Overall a decent meal for a decent price...I've had better..but will definitely come back for the pork jerky...service is good too, so definitely worth trying.";"0";"0";"0";"Thai Style Noodle House 2";"Las Vegas";"NV";"Vegan"
"-fz066ZxjhBShhvOWfch9A";"5";"2010-05-17 00:00:00";"Being a vegetarian for over 10 years I was very excited to fall upon this restaurant wandering Madison. My husband, however, is not a vegetarian at all. After we went to have lunch here, I think a switch was turned on for him- vegetarian food can be filling and tasty and I don't need meat at every meal. He loved the Mediterranean appetizer and was had a hard time choosing what to eat for lunch. I mainly enjoyed this because of the enlightening moment my husband had but that is not to take away anything from the fantastic waitstaff, the decor, and the menu.";"0";"0";"0";"The Green Owl Cafe";"Madison";"WI";"Vegan"
"-fzqSa1X3NmPurOQDrSw9Q";"5";"2016-12-17 00:00:00";"I've come to this restaurant for a quick lunch a few times now. Each time the staff has been so friendly and accommodating of a speedy ""in-and'out"". The food is awesome. My favourite items on the menu are the falafel and the maca smoothie (I think it's called the French Toast smoothie on the menu). 

It is a bit pricey, but the food is worth it and I don't mind paying a bit more for fresh ingredients.";"2";"0";"0";"Raw Aura";"Mississauga";"ON";"Vegan"
"-g5blxbKP5SPFLfrkIuv5A";"5";"2010-12-27 00:00:00";"Fantastic bbq seitan sandwich. Even better than the one offered @ clover in cambridge, ma!";"2";"0";"0";"The Red Herring Vegetarian Restaurant";"Urbana";"IL";"Vegan"
"-Gay0Spi9JN5yTVbVDQlzQ";"5";"2017-08-29 00:00:00";"The atmosphere was great for a Sunday night. They have great chimichangas and sangria! The service is wonderful as well. If you're in the mood for Mexican, definitely try this place!";"0";"0";"0";"Hussong's Cantina Boca Park";"Las Vegas";"NV";"Vegan"
"-GbsYFoBjT7jR33INrgnOw";"5";"2016-02-27 00:00:00";"Adding Kung Pao Chicken to the list of amazing items to get here. It's been about two months since my last visit and my waiter remembered exactly what I ordered last time, as well as my peanut allergy. Awesome!";"1";"1";"1";"Veggie House";"Las Vegas";"NV";"Vegan"
"-gCkDcAXvy4uOLWS_tmypw";"5";"2009-09-26 00:00:00";"I don't get to eat donuts often, and i don't really want to, but when i am visiting vegas it is so great to have this treat of a place.  soooooo many different vegan donuts.  the creme filled was the best, the cinnamon rolls were soooooooo good too!  the people working were so nice.  

i'm not even sure if most of the people there realized they were eating vegan donuts, it just seems like a regular donut shop till you ask.";"0";"0";"0";"Ronald's Donuts";"Las Vegas";"NV";"Vegan"
"-gckZKhB9c18VSw4Y4DxjQ";"5";"2011-04-14 00:00:00";"Best Mongolian BBQ I've ever had anywhere hands down. There's also a full bar and sake bombers. Had to go rub one off in the bathroom due to my massive food chubby.
OOM NOM NOM NOM NOM! FAP FAP FAP FAP FAP!
Will repeat soon.";"5";"7";"0";"Genghis Grill";"Tempe";"AZ";"Vegan"
